{
  "election_id": "na-2020-21",
  "district_id": "seoul-jung",
  "winner_party_id": "dpk",
  "winner_candidate": "홍익표",
  "turnout_pct": 66.2,
  "candidates": [
    {
      "name": "홍익표",
      "party_id": "dpk",
      "votes": 73238,
      "vote_pct": 54.25
    },
    {
      "name": "진수희",
      "party_id": "ufp",
      "votes": 55256,
      "vote_pct": 40.93
    },
    {
      "name": "Combined other candidates",
      "party_id": "other",
      "votes": 6507,
      "vote_pct": 4.82
    }
  ]
}
